{
  "$schema": "https://json-schema.org/draft/2020-12/schema",
  "title": "Enterprise AI Diagnostic Master Record",
  "type": "object",
  "required": [
    "record_type", "schema_version", "record_id", "version",
    "enterprise_id", "project_id", "project_identity", "current_stage",
    "research_coverage", "workflow_cards", "materials",
    "conflicts_and_evidence_requests", "organizational_confirmations",
    "diagnoses_and_pilots", "output_views"
  ],
  "properties": {
    "record_type": {"const": "enterprise_ai_diagnostic_master_record"},
    "schema_version": {"const": "0.1"},
    "record_id": {"type": "string", "minLength": 1},
    "version": {"type": "integer", "minimum": 1},
    "enterprise_id": {"type": "string", "minLength": 1},
    "project_id": {"type": "string", "minLength": 1},
    "project_identity": {
      "type": "object",
      "required": ["enterprise_display_name", "project_name", "project_owner_role", "created_at"],
      "properties": {
        "enterprise_display_name": {"type": "string"},
        "project_name": {"type": "string", "minLength": 1},
        "project_owner_role": {"type": "string", "minLength": 1},
        "created_at": {"type": "string", "format": "date-time"}
      },
      "additionalProperties": false
    },
    "current_stage": {
      "type": "object",
      "required": ["stage", "status", "owner_role", "updated_at"],
      "properties": {
        "stage": {"enum": ["interview_preparation", "workflow_mapping", "evidence_completion", "diagnosis", "pilot", "completed", "paused"]},
        "status": {"enum": ["not_started", "active", "blocked", "review_required", "completed", "paused"]},
        "owner_role": {"type": "string"},
        "updated_at": {"type": "string", "format": "date-time"},
        "stop_reason": {"type": ["string", "null"]}
      },
      "additionalProperties": false
    },
    "research_coverage": {"type": "array", "items": {"$ref": "#/$defs/coverage"}},
    "workflow_cards": {"type": "array", "items": {"$ref": "#/$defs/indexedRecord"}},
    "materials": {"type": "array", "items": {"$ref": "#/$defs/materialRecord"}},
    "conflicts_and_evidence_requests": {"type": "array", "items": {"$ref": "#/$defs/indexedRecord"}},
    "organizational_confirmations": {"type": "array", "items": {"$ref": "#/$defs/indexedRecord"}},
    "diagnoses_and_pilots": {"type": "array", "items": {"$ref": "#/$defs/diagnosticRecord"}},
    "output_views": {"type": "array", "items": {"$ref": "#/$defs/outputView"}}
  },
  "$defs": {
    "authorizationStatus": {"enum": ["pending", "authorized", "restricted", "withdrawn", "not_required"]},
    "lifecycleStatus": {"enum": ["draft", "current", "superseded", "invalid", "archived"]},
    "indexedRecord": {
      "type": "object",
      "required": ["record_id", "record_type", "version", "lifecycle_status", "enterprise_id", "project_id", "authorization_status", "upstream_records", "supersedes", "change_reason", "storage_ref", "created_at", "created_by_role"],
      "properties": {
        "record_id": {"type": "string", "minLength": 1},
        "record_type": {"type": "string", "minLength": 1},
        "version": {"type": "integer", "minimum": 1},
        "lifecycle_status": {"$ref": "#/$defs/lifecycleStatus"},
        "enterprise_id": {"type": "string", "minLength": 1},
        "project_id": {"type": "string", "minLength": 1},
        "authorization_status": {"$ref": "#/$defs/authorizationStatus"},
        "upstream_records": {"type": "array", "items": {"type": "string", "pattern": "^[^@]+@[1-9][0-9]*$"}},
        "supersedes": {"type": ["string", "null"]},
        "change_reason": {"type": "string"},
        "storage_ref": {"type": "string", "minLength": 1},
        "created_at": {"type": "string", "format": "date-time"},
        "created_by_role": {"type": "string", "minLength": 1},
        "participant_id": {"type": "string"},
        "process_id": {"type": "string"}
      },
      "additionalProperties": true
    },
    "materialRecord": {
      "allOf": [
        {"$ref": "#/$defs/indexedRecord"},
        {"type": "object", "required": ["analysis_status"], "properties": {"analysis_status": {"enum": ["received", "pending_analysis", "analyzed", "unusable", "withdrawn"]}}}
      ]
    },
    "diagnosticRecord": {
      "allOf": [
        {"$ref": "#/$defs/indexedRecord"},
        {"type": "object", "required": ["review_status"], "properties": {"review_status": {"enum": ["draft", "review_required", "approved", "rejected"]}}}
      ]
    },
    "coverage": {
      "type": "object",
      "required": ["department_id", "role", "process_id", "planned_participants", "status"],
      "properties": {
        "department_id": {"type": "string"},
        "role": {"type": "string"},
        "process_id": {"type": "string"},
        "planned_participants": {"type": "integer", "minimum": 0},
        "status": {"enum": ["not_planned", "not_scheduled", "not_submitted", "declined", "received_pending_analysis", "analyzed", "unusable"]},
        "gap": {"type": "string"}
      },
      "additionalProperties": false
    },
    "outputView": {
      "type": "object",
      "required": ["view_id", "audience_role", "publication_status", "source_records", "allowed_sections", "excluded_sections"],
      "properties": {
        "view_id": {"type": "string", "minLength": 1},
        "audience_role": {"enum": ["employee", "enterprise_leader", "enterprise_it", "transformation_practitioner"]},
        "publication_status": {"enum": ["draft", "review_required", "approved", "published", "withdrawn"]},
        "source_records": {"type": "array", "items": {"type": "string"}},
        "allowed_sections": {"type": "array", "items": {"type": "string"}},
        "excluded_sections": {"type": "array", "items": {"type": "string"}}
      },
      "additionalProperties": false
    }
  },
  "additionalProperties": false
}
